{
  "$schema": "../schemas/tokens.v1.json",
  "namespace": "clbr",
  "brand": null,
  "modifierOrder": [
    "size",
    "root"
  ],
  "defaultContext": {
    "size": "baseline",
    "root": "default"
  },
  "tokens": {
    "primitive.breakpoint.2xs": {
      "layer": "primitive",
      "$value": "320px"
    },
    "primitive.breakpoint.xs": {
      "layer": "primitive",
      "$value": "384px"
    },
    "primitive.breakpoint.sm": {
      "layer": "primitive",
      "$value": "768px"
    },
    "primitive.breakpoint.md": {
      "layer": "primitive",
      "$value": "1024px"
    },
    "primitive.breakpoint.lg": {
      "layer": "primitive",
      "$value": "1280px"
    },
    "primitive.breakpoint.xl": {
      "layer": "primitive",
      "$value": "1440px"
    },
    "primitive.breakpoint.2xl": {
      "layer": "primitive",
      "$value": "1536px"
    },
    "primitive.spacing.100": {
      "layer": "primitive",
      "$value": "1px"
    },
    "primitive.spacing.200": {
      "layer": "primitive",
      "$value": "2px"
    },
    "primitive.spacing.250": {
      "layer": "primitive",
      "$value": "3px"
    },
    "primitive.spacing.300": {
      "layer": "primitive",
      "$value": "4px"
    },
    "primitive.spacing.400": {
      "layer": "primitive",
      "$value": "6px"
    },
    "primitive.spacing.500": {
      "layer": "primitive",
      "$value": "8px"
    },
    "primitive.spacing.600": {
      "layer": "primitive",
      "$value": "12px"
    },
    "primitive.spacing.700": {
      "layer": "primitive",
      "$value": "16px"
    },
    "primitive.spacing.800": {
      "layer": "primitive",
      "$value": "18px"
    },
    "primitive.spacing.900": {
      "layer": "primitive",
      "$value": "24px"
    },
    "primitive.spacing.966": {
      "layer": "primitive",
      "$value": "30px"
    },
    "primitive.spacing.1000": {
      "layer": "primitive",
      "$value": "32px"
    },
    "primitive.spacing.1100": {
      "layer": "primitive",
      "$value": "36px"
    },
    "primitive.spacing.1200": {
      "layer": "primitive",
      "$value": "48px"
    },
    "primitive.spacing.1300": {
      "layer": "primitive",
      "$value": "60px"
    },
    "primitive.spacing.1400": {
      "layer": "primitive",
      "$value": "72px"
    },
    "primitive.spacing.1500": {
      "layer": "primitive",
      "$value": "84px"
    },
    "primitive.spacing.1600": {
      "layer": "primitive",
      "$value": "96px"
    },
    "primitive.spacing.1700": {
      "layer": "primitive",
      "$value": "108px"
    },
    "primitive.spacing.1800": {
      "layer": "primitive",
      "$value": "120px"
    },
    "primitive.spacing.1900": {
      "layer": "primitive",
      "$value": "144px"
    },
    "primitive.spacing.2000": {
      "layer": "primitive",
      "$value": "168px"
    },
    "primitive.spacing.2100": {
      "layer": "primitive",
      "$value": "192px"
    },
    "primitive.layout.container.max-width.lg": {
      "layer": "primitive",
      "$value": "1280px"
    },
    "primitive.layout.container.max-width.xl": {
      "layer": "primitive",
      "$value": "1440px"
    },
    "primitive.layout.focus-ring.outset": {
      "layer": "primitive",
      "$type": "dimension",
      "$value": "8px"
    },
    "primitive.layout.focus-ring.offset.default": {
      "layer": "primitive",
      "$value": "2px"
    },
    "primitive.layout.focus-ring.offset.lg": {
      "layer": "primitive",
      "$value": "4px"
    },
    "primitive.layout.focus-ring.offset.inset": {
      "layer": "primitive",
      "$value": "-4px"
    },
    "primitive.layout.grid.columns": {
      "layer": "primitive",
      "$type": "number",
      "$value": 12
    },
    "primitive.layout.grid.item.min-width": {
      "layer": "primitive",
      "$type": "dimension",
      "$value": "288px"
    },
    "primitive.layout.icon.size.2xs": {
      "layer": "primitive",
      "$value": "16px"
    },
    "primitive.layout.icon.size.xs": {
      "layer": "primitive",
      "$value": "18px"
    },
    "primitive.layout.icon.size.sm": {
      "layer": "primitive",
      "$value": "20px"
    },
    "primitive.layout.icon.size.md": {
      "layer": "primitive",
      "$value": "24px"
    },
    "primitive.layout.icon.size.lg": {
      "layer": "primitive",
      "$value": "28px"
    },
    "primitive.layout.icon.viewbox.inset-ratio": {
      "layer": "primitive",
      "$type": "number",
      "$value": 0.0833333333
    },
    "primitive.layout.icon.viewbox.outset-ratio": {
      "layer": "primitive",
      "$type": "number",
      "$value": -0.0833333333
    },
    "breakpoint.baseline": {
      "layer": "semantic",
      "$description": "Baseline breakpoint. The smallest viewport the system targets. Layouts should be functional at this width.",
      "$value": "320px"
    },
    "breakpoint.mobile": {
      "layer": "semantic",
      "$description": "Mobile breakpoint. Use as the boundary between baseline and mobile-class layouts.",
      "$value": "384px"
    },
    "breakpoint.tablet": {
      "layer": "semantic",
      "$description": "Tablet breakpoint. Use as the boundary at which tablet-class layouts engage.",
      "$value": "768px"
    },
    "breakpoint.notebook": {
      "layer": "semantic",
      "$description": "Notebook breakpoint. Use as the boundary at which compact-laptop-class layouts engage.",
      "$value": "1024px"
    },
    "breakpoint.laptop": {
      "layer": "semantic",
      "$description": "Laptop breakpoint. Use as the boundary at which standard-laptop-class layouts engage.",
      "$value": "1280px"
    },
    "breakpoint.desktop": {
      "layer": "semantic",
      "$description": "Desktop breakpoint. Use as the boundary at which desktop-class layouts engage.",
      "$value": "1440px"
    },
    "breakpoint.widescreen": {
      "layer": "semantic",
      "$description": "Widescreen breakpoint. Use as the boundary at which widescreen-class layouts engage.",
      "$value": "1536px"
    },
    "spacing.vertical.100": {
      "layer": "semantic",
      "$description": "Vertical spacing step 100. Minimal vertical step.",
      "$value": "1px"
    },
    "spacing.vertical.200": {
      "layer": "semantic",
      "$description": "Vertical spacing step 200.",
      "$value": "2px"
    },
    "spacing.vertical.250": {
      "layer": "semantic",
      "$description": "Vertical spacing step 250.",
      "$value": "3px"
    },
    "spacing.vertical.300": {
      "layer": "semantic",
      "$description": "Vertical spacing step 300.",
      "$value": "4px"
    },
    "spacing.vertical.400": {
      "layer": "semantic",
      "$description": "Vertical spacing step 400.",
      "$value": "6px"
    },
    "spacing.vertical.500": {
      "layer": "semantic",
      "$description": "Vertical spacing step 500.",
      "$value": "12px"
    },
    "spacing.vertical.600": {
      "layer": "semantic",
      "$description": "Vertical spacing step 600.",
      "$value": "18px"
    },
    "spacing.vertical.700": {
      "layer": "semantic",
      "$description": "Vertical spacing step 700. Default vertical step.",
      "$value": "24px"
    },
    "spacing.vertical.775": {
      "layer": "semantic",
      "$description": "Vertical spacing step 775.",
      "$value": "30px"
    },
    "spacing.vertical.800": {
      "layer": "semantic",
      "$description": "Vertical spacing step 800.",
      "$value": "36px"
    },
    "spacing.vertical.900": {
      "layer": "semantic",
      "$description": "Vertical spacing step 900.",
      "$value": "48px"
    },
    "spacing.vertical.950": {
      "layer": "semantic",
      "$description": "Vertical spacing step 950.",
      "$value": "60px"
    },
    "spacing.vertical.1000": {
      "layer": "semantic",
      "$description": "Vertical spacing step 1000.",
      "$value": "72px"
    },
    "spacing.vertical.1100": {
      "layer": "semantic",
      "$description": "Vertical spacing step 1100.",
      "$value": "84px"
    },
    "spacing.vertical.1200": {
      "layer": "semantic",
      "$description": "Vertical spacing step 1200.",
      "$value": "96px"
    },
    "spacing.vertical.1250": {
      "layer": "semantic",
      "$description": "Vertical spacing step 1250.",
      "$value": "108px"
    },
    "spacing.vertical.1300": {
      "layer": "semantic",
      "$description": "Vertical spacing step 1300.",
      "$value": "120px"
    },
    "spacing.vertical.1400": {
      "layer": "semantic",
      "$description": "Vertical spacing step 1400.",
      "$value": "144px"
    },
    "spacing.vertical.1500": {
      "layer": "semantic",
      "$description": "Vertical spacing step 1500.",
      "$value": "168px"
    },
    "spacing.vertical.1600": {
      "layer": "semantic",
      "$description": "Vertical spacing step 1600. Largest vertical step.",
      "$value": "192px"
    },
    "spacing.horizontal.100": {
      "layer": "semantic",
      "$description": "Horizontal spacing step 100. Minimal horizontal gap.",
      "$value": "1px"
    },
    "spacing.horizontal.200": {
      "layer": "semantic",
      "$description": "Horizontal spacing step 200.",
      "$value": "2px"
    },
    "spacing.horizontal.300": {
      "layer": "semantic",
      "$description": "Horizontal spacing step 300.",
      "$value": "4px"
    },
    "spacing.horizontal.400": {
      "layer": "semantic",
      "$description": "Horizontal spacing step 400.",
      "$value": "8px"
    },
    "spacing.horizontal.500": {
      "layer": "semantic",
      "$description": "Horizontal spacing step 500.",
      "$value": "12px"
    },
    "spacing.horizontal.600": {
      "layer": "semantic",
      "$description": "Horizontal spacing step 600.",
      "$value": "16px"
    },
    "spacing.horizontal.700": {
      "layer": "semantic",
      "$description": "Horizontal spacing step 700. Default horizontal step.",
      "$value": "24px"
    },
    "spacing.horizontal.800": {
      "layer": "semantic",